{
  "id": "ev-001",
  "kind": "eval",
  "grader": "independent",
  "format": "command-transcript",
  "summary": { "metric": "task_pass", "before": 0, "after": 1, "n": 3 },
  "artifact": {
    "path": "ev-001.log",
    "sha256": "sha256:37150c5a7365f161dc30d23e8f1b4c4545ef606a0afc15bf3bc77697b6f15fb9"
  }
}
